title,genre,desc
Sapoot,Action,"Sharanya, a shy and introverted person, is a native of Kollengode, Palakkad who moves to Thrissur to pursue engineering. She finds it difficult to cope with her new surroundings in college and her hostel."
Junglee,Comedy,"Shashirekha works as an investigative journalist for a leading media company. While at an orphanage, she is introduced to Chandrasekhar who is covering the news. On the other hand, a series of murders take place."
Coldd Lassi Aur Chicken Masala,Romance,"Shattered by his break-up, a disturbed young man Varun takes an instant decision to get married and things take a different turn for him as he ends up falling for the bride's sister Amulya instead during the bridal gaze."
Dheena,Action,She was forced into prostitution. She is considered less than human. She is full of anger. Now she recounts her brutal life story to a documentary filmmaker.
Ek Mini Katha,Comedy,She will offer you everything you desire; in return she will take your soul.
Hello Guru Prema Kosame,Comedy,"Sheer Qorma is a story of belonging and acceptance, identity and family told through courageous, queer women choose to embrace love that exists beyond their personal beliefs and social moralities."
Sreedharante Onnam Thirumurivu,Comedy,Shekar (Jeetendra) and Lalita (Sulakshana Pandit) are neighboring childhood friends. Shekar belongs to rich family whereas Lalita is middle-class girl both of them love each other but ... See full summary »
Pathrosinte Padappukal,Comedy,"Shekar is an ardent admirer of Chinna who runs an underworld gang. Once paired up, the two of them single-handedly take on the streets of Chennai. But Shekar falls in love and wants to be reformed."
Chal Hat Kono Dekh Lihi,Drama,"Shekaran,a humble and pretty man has a dark past in Bombay.His dark underworld side slowly resurfaces when his enimies from past attacks his family"
Barathi Kannamma,Drama,"Shekhar accidentally kills his associate Amar, and decides to watch over Amar's company and take care of his family and friends. However, he falls in love with Amar's fiancé Piya."
Chain Kulii Ki Main Kulii,Comedy,"Shekhar appoints Simran, a lawyer with an impeccable record, to represent him as he was accused of murdering his wife and soon she starts falling in love with him. Little she knows that Shekhar has some darker intentions."
Udanpirappe,Drama,"Shekhar is an opportunist. He marries Veena, a multi-millionaire, while continuing his affair with her secretary, Anu. When Veena gets to know, she threatens him with dire consequences. ... See full summary »"
Mangalyam,Drama,"Shekhar is in love with Pooja and would like to marry her. Pooja is the only daughter of Choudhury, the apple of his eye, and he agrees to get her married to Shekhar. Shekhar informs his ... See full summary »"
Kyun Utthe Dil Chhod Aaye,Drama,"Shekhar lives a wealthy lifestyle with in widowed mother, Gauri, in Jamuna Nagar, India and manages an estate. The region is being terrorized by a tiger which was wounded by him and has ... See full summary »"
Ayya,Drama,Shelved Movie during legal issues. The Movie is a scene by scene copy of My Cousin Vinny a 1992 American comedy film directed by Jonathan Lynn
The Great Indian Family,Romance,"Shem (Adil Hussain), an out-of-work self-styled detective with a sharp sense of the streets, escapes the lethargy of small-town Shillong when he is asked to investigate the disappearance of... See full summary »"
Hum Paanch,Comedy,Sher Khan robs a bank and the blame is put on Sadhuram. Sher Khan alias Dilawar Khan gets killed and his body is found in Bajrang's taxi. Both Sadhuram and Bajrang are on the run from the police.
Laakhon Mein Ek,Drama,Sher Singh and Arjun Singh are identical twin brothers. Arjun is an honest police officer but Sher Singh becomes a dacoit under the influence of Bajrang and his gang. Sher Singh's daughter ... See full summary »
Jhankaar Beats,Comedy,Sherin is pursuing a journey through lives of many children's who went through brutal abuses in past. She meets with many stories for her documentary including story of Naseema and Anna which makes U Turn to Sherin's past.
Shiddat,Romance,"Shershaah is the story of PVC awardee Indian soldier Capt. Vikram Batra, whose bravery and unflinching courage in chasing the Pakistani soldiers out of Indian territory contributed immensely in India finally winning the Kargil War in 1999."
Mastizaade,Comedy,Sheth Kapurchand Mangaldas Vidyalaya is one of the last existing Gujarati medium schools. Principal of the school wants to preserve his heritage and is struggling with changing world. Enter... See full summary »
LOC: Kargil,Drama,Shikara is the story of resilience in the face of insurmountable odds. It's also the story of a love that remains unextinguished through 30 years of exile. A timeless love story in the worst of times.
Miruthan,Action,Shikarpur is ruled by Gangadhar Chaudhary whose known to grab lands of poor farmers and kill them if they don't agree one such victim of his crime is Veer Singh who gets killed leaving his ... See full summary »
Kasak,Drama,"Shikha embarks on a journey where reality and illusions mingle and she has to find her way through a maze of love, deception, hate, revenge as well as death in her quest to discover the truth."
Harano Sur,Drama,"Shilpa, a student, loves Kartik, a doctor who is married. Everything starts to crumble when Kartik's wife becomes suspicious about his affair."
Khuda Gawah,Action,"Shinda tries robbing a bank so he can be wealthy enough to marry the love of his life. He ends up getting caught, but it turns out that he has a much bigger plan in mind, involving one of Punjab's biggest criminals."
Ami Thumi,Comedy,Shinda was mistreated by his relatives therefore he finds other ways to have his love Laali. Shinda and his two other friends come up with a plan to solve all of their problems.
Josh,Action,"Shiny is looking after her bedridden mother-in-law, living along with her father-in-law Kuttichan. Tensions arise pushing Shiny to the point where she cannot take anymore."
Mandi,Comedy,Shirke Patil a wealthy family Gauri a sweet and innocent girl believing in sacrifices up in their house as a maid only to face insults an humiliation specially from Shalini who demotivates ... See full summary »
Angaar,Action,"Shirley and Roy in the middle of an impending Covid lock-down and a personal financial crisis, leave their Mumbai home for Shirley's home in Pala where her father Ittyavira stays. Roy soon finds that her home is not what he thought it is."
Yeh Saali Aashiqui,Drama,Shiv (Abhishek Bachchan) and Pooja (Karisma Kapoor) are happily married to each other but sometimes can get into the most petty arguments coming from the way they approach life. Shiv takes ... See full summary »
Bachelor,Drama,Shiv Mathur is an addict and eventually finds himself in a rehab facility. The rehab is run by people who are working on a mysterious compound. This magical pill seems to have an edge above all; but is this miracle drug worth dying for?
Girlfriend Chor,Romance,"Shiva and Athulya try to make their long-distance relationship work. However, Athulya's colleague Karthik develops feelings for her, which complicates the bond between them."
Baadshah,Action,Shiva and Nandini fall in love with each other but their parents are political heads of the village then complications arise when they elope.
Mashaal,Action,"Shiva grows up to be a strong tempered person and his grandfather often advises him to control his anger. After his grandfather passed away, Shiva moves to a new town where something triggers his temper. What will he do?"
Muthal Mariyathai,Drama,"Shiva is a roadside Romeo, accidentally falls in love with Mahi but they break up soon. He then fell in love with Priyanka but the relationship runs into some issues. He later finds true love with Sandhya. Will it last?"
22 Female Kottayam,Drama,Shiva is an escaped convict who is looking for a suitable place to hide from the police. His adventures lead him to end up in a rural region which happens to be the main target of bandits ... See full summary »
Ram Aur Shyam,Comedy,Shiva is blessed with magical powers of charming snakes. He falls head-over-heels in love with Paro.
Mummy Punjabi: Superman Ki Bhi Maa!!,Comedy,"Shiva is disgusted by the corruption in and around his new college, and along with his friends, he decides to take a stand against the status quo."
Mr. & Mrs. Khiladi,Comedy,"Shiva meets Parvatha and the couple falls in love. However, misunderstandings weaken their bond and forces Parvatha to rethink about their relationship."
Kummatty,Drama,"Shiva Rama Raju, a self-righteous man, bets with Veerraju, a courteous man from the same village, that if any of his three daughters fall in love, he will either kill them or chop off his own ears."
The Rose Villa,Horror,"Shiva Rama Raju, a self-righteous man, bets with Veerraju, a courteous man from the same village, that if any of his three daughters fall in love, he will either kill them or chop off his own ears."
En Thangai Kalyani,Drama,Shivaji Maharaj was born in a collapsing kingdom where fought against the Mughal empire and went on establish the Maratha empire. The series takes covers well detailed sequences with his ... See full summary »
Maha-Sangram,Action,"Shivam Sharma, a bachelor living with his roommate Dharam finally gets lockdown with his crush. The intimations with his crush gets things to chaos."
Hostel Days,Comedy,"Shivamma is an ardent sales rep for the energy drink Nuracle. The multilevel marketing method at Nuracle is her only belief and motivation for life. To Shivamma, living in a poor town on ... See full summary »"
Kunjeldho,Comedy,Shivan revolves around a couple who are very much in love but one day the woman is found dead and the man is found guilty and imprisoned. But once he is in jail he recollects certain memories that change everything.
Chakki,Drama,"Shivangi, a 10 year old girl, is put to the ultimate test to save her family's village from the restless ghosts of its horrific past."
Jatugriha,Drama,"Shivaraj falls in love with his manager's daughter, Shruthi. However, she refuses his proposal and challenges him to first earn Rs 5000 without using any influence."
Banjo,Action,"Shivnath Choudhary lives a wealthy lifestyle in Chandanpur, India, along with his wife, Leela, and 8 year old daughter, Neena. He likes to mingle with poor folk much, especially Baiju, to ... See full summary »"
Hichki,Comedy,"SHIVPRATAP-GARUDJHEP ""The saga of a battle which defeated Aurangzeb and mighty Mughals without a drop of bloodshed."" In the treaty of Purandhar, as decided, Shivaji Maharaj agrees to visit ... See full summary »"
"Gallit Gondhal, Dillit Mujra",Comedy,"Shivshankar, a wheelchair-bound man, tries to make his son Vishnu aware of his responsibilities but to no avail. Things take a turn for the worse after Vishnu starts stealing and tries to rape a girl."
Dakuaan Da Munda,Action,Shoba T. Mathur works for the Central Government in India and her job is to create awareness against child-marriage and other social evils that prevail due to general misinterpretation of ... See full summary »
Woh Ladki Hai Kahaan,Drama,Shoban Babu meditates for Brahma and asks to grant him the power to know the future. Brahma gives him some kind of milk and asks him to drink it to get the power. Unfortunately his friend Srinu drinks that and things changes a lot then.
Baabul,Drama,Short films follow young adults as they navigate the gamut of emotions that come with finding romantic connection in unexpected places.
Ka Pae Ranasingam,Drama,Short stories exploring today's concepts in ancient Indian contexts.
Aashiqui 3,Drama,"Shortly after a tornado rips through her Kansas home, Dorothy returns to Oz to save her friends from a villainous jester."
Anubhav,Drama,"Showcasing stories inspired from real life events, this fictionalized investigative thriller plunges viewers into the world of Dev Burman - a detective who is an enigma in himself."
Arul,Action,"Shree, an ordinary man, works at a telecom company. In love with Sonu but cannot marry yet as need to make some basic money. Randhawa, a wealthy businessman, in his ceaseless pursuit of ... See full summary »"
Victory,Drama,Shreyas discovers the magic of love and friendship in college days; only to be perplexed with the choices to be made.
Chhoto Bou,Drama,"Shrikant Pandit lives a struggling life-style in a rented apartment with his wife, Aditi. Due to his busy working schedule Shrikant is unable to provide enough love and affections to Aditi ... See full summary »"
Always Kabhi Kabhi,Comedy,Shrirang returns to his palatial house in his village where he is haunted by his ancestors.
Nalai Namadhe,Drama,"Shriranga Deshmukh is frustrated with the women in his life. At a fair, he gets a gift from the higher powers, and from there on life changes as he can hear what women want."
Kalubaichya Naavan Changbhala,Drama,Shruti [child artiste Hansika Motwani] is the 10-year-old daughter of Shrikant [Sanjay Kapoor] and Shraddha [Raveena Tandon]. She travels to her school by the local train every morning. One... See full summary »
Kedarnath,Drama,"Shruti and Bittoo become partners in their very own ""Wedding planning ka bijness"" in Delhi and in the process discover friendship, love and one another."
Sabki Laadli Bebo,Drama,Shudra - The Rising is the story of 250 million people subjugated in war and condemned to slavery and bestial existence for ages. These peace loving and imprudent people of ancient times ... See full summary »
Vellimoonga,Comedy,"Shy nerd Aryan learns soon after his 18th birthday that he has inherited superpowers, which he must use to vanquish a variety of evil threats."
Velan,Comedy,"Shyam and Kamal are two school-going students who are close friends. When Kamal is unable to pay his exam fees, Shyam assists him, and as a result Kamal does well, is able to study further,... See full summary »"
Mudda 370 J&K,Action,"Shyam works for Mr. Choudhry, and lives in a small village in India with his mother. Ranjeet, Shyam's childhood friend, returns from overseas, and all are overjoyed to see him back. Ranjeet... See full summary »"
Parineeta,Romance,"Shyam, a middle-class man, falls in love with a millionaire's daughter and marries her. However, as their relationship starts deteriorating, Shyam finds solace in the company of Radha."
Sagardwipey Jawker Dhan,Action,"Shyamlal has a happy family with his wife Anu, and step-brother Ram. Anu take care of Ram as her own son. Anu's mother came to her house, who wants that Anu should hate Ram. This creates rift between Anu and Ram."
Ranadheera,Action,"Shyamu is an orphan, living with his mentor, and has made stealing his career. While his mentor is recuperating in hospital, from a fracture, Shyamu decides to go straight. He is mistaken ... See full summary »"
Pushpa: The Rise - Part 1,Action,Siberian gulag escapees travel four thousand miles by foot to freedom in India.
Meghdoot,Drama,Siblings Natasha and Kabir Merchant investigate an allegedly haunted mirror in their parents' home in this official adaption of 'Oculus'.
Razia Sultan,Action,Siblings on competing cricket teams struggle to balance family and team loyalties.
Puncch Beat,Drama,Siddardha is mesmerised by Meera's physical beauty but his life takes a turn when he learns that she is suffering from an unusual disease that could disable her physically.
Shalimar,Action,"Siddharth Abimanyu, an influential scientist, is involved in various illegal medical practices. Mithran, an efficient IPS officer, decides to expose him."
Home Shanti,Comedy,"Siddharth and Sonia are happily married to each other until Anna walks into Siddharth's life. Things takes a worst turn, when Anna gets killed and Siddharth finds himself in deep trouble."
Haqeeqat,Action,"Siddharth is a well-known news anchor of a popular news channel called ""India Now"". But along with his being a capable and known anchor, he was also blessed with an unusual superpower. He ... See full summary »"
Bai Chale Sasariye,Drama,Siddharth often has problems with his wife Anjali owing to his short temper. Things take an unexpected turn when they get involved with a gangster.
Bhogam Rani,Drama,"Siddharth strives to help flood victims and saves the relief material from falling into the wrong hands. This sets off a war between him and a corrupt politician, which leads to many twists and turns."
Murder,Drama,"Siddharth, a hotelier, takes up the responsibility of repairing the relationship between his independent wife, Roshni, and his enterprising mother-in-law, Durga Devi."
Chandni Chowk to China,Action,"Siddhartha Reddy gets a posting as a district collector for the Guntur district in Andhra Pradesh. There he goes against Rajappa, a local rowdy and politician."
Ready,Action,"Siddhu is a genius boy right from his childhood. He has terrific memory power and even enters the Gunnies book of World Records. On the other hand, Kanaka Mahalakshmi's only dream is to win... See full summary »"
Ethir Neechal,Comedy,"Siddhu, a simple guy, falls for Nisha and gets attached to her. A series of events leads to their separation and Siddhu becomes a Rockstar. Why did they separate? What went wrong between them?"
Pretham 2,Comedy,"Sidharth, his best friend Sam and their gang of friends rediscover bonds of friendship and love."
Trishna,Drama,"Sidhu breaks his father's trust when he defies him and continues his relationship with Priya, the girl he loves. Determined to win Sidhu's father's heart, Priya decides to stay with his family."
Intinti Gruhalakshmi,Drama,"Sigma, a space city (running on fusion energy) docked at a Galactic frontier, is the last stand of humans against an even more technologically superior alien race ruled by one ZhakhaKoo."
Jai Mummy Di,Comedy,"SILSILA is a love story, thwarted by society's demands, which reappears as adultery but can it survive in the face of society?"
Babumoshai Bandookbaaz,Action,"Simhadri, A loyal servant in a landlords house also leads a secret life as Singamalai, a powerful leader in the state of Kerala"
Sammathame,Romance,Simi Garewal has an intimate rendevouz with some of the best stars in India.
Sher Shivraj,Action,"Simmba, a Corrupt Officer, enjoys all the perks of being an immoral and unethical police officer until a life-changing event forces him to choose the righteous path."
Iss Mod Se Jaate Hain,Drama,"Simon, representative of a pharmaceutical company from France and Asgar, local auto driver from Shivajinagar, share a two-day long journey in Bengaluru. That twisted journey with comedy of errors changes the way they look at life."
Afsos,Comedy,"Simple and straightforward Sudhir gets hitched to Kriya, a smart, liberal and extremely modern Londoner but they gradually realize that even though their horoscopes are a perfect match, ... See full summary »"
Padikkathavan,Action,Simple Lovestory of kisu who is poor and sudha who belongs to rich family which comes to an end after long period.
Uma Maheswara Ugra Roopasya,Drama,"Simpleton and honest village farmer, Dharamchand alias Dharam is overjoyed when his wife, Radha gives birth to a baby boy who is christen with the name Raju. He comes to the rescue of three... See full summary »"
The Broken News,Drama,"Simran gets Ranjeet arrested for crimes. Ranjeet escapes, but returns in disguise to visit Simran. Unaware of the identify of his visitor, Simran informs Sumeet, who organizes a party. ... See full summary »"
I Think I Love My Wife,Comedy,"Simran, who relocates to Seoul, is distraught when Daya, a gangster, re-enters her life. She has to make a choice between him and her lover Akash, who is a singer at an Indian restaurant."
Ustad Hotel,Comedy,"Since 1965 bitter hatred and animosity has reigned between two families, namely that of Indrasen's and the Reddys, which results in the death of Indrasen's dad, and his two uncles, one of ... See full summary »"
Maa Tujhhe Salaam,Action,"Since Anjooran hates women, his sons remain unmarried. However, everything changes when his youngest son, Ramabhadran, falls in love with Malu, whose grandmother is their family's biggest enemy."
Paradesi,Drama,"Since gaining independence in 1947, India has been a secular state. But now, as religious fundamentalism grips much of India's population, the greatest danger to the nation's extremely ... See full summary »"
Taarak Mehta Ka Ooltah Chashmah,Comedy,"Since he was a child, Aladin Chatterjee has been teased for his fairytale name. As a college student he follows his namesake's footsteps; unleashing genie Genius and wooing exchange student Jasmine. But the evil Ringmaster approaches."
Apna Asmaan,Drama,"Since Subhadra's father left them, her mother has faced snide remarks from the society. All she wants for her daughter is to live a scrupulous life. However, Subhadra falls in love with Raja."
Anurodh,Drama,"Singaaravelan (Kamal Hassan) living in a village with his mother who was accused of the demise of her brother and sister-in-law. Now, he sets on course to remove the stains on his mother's name."
Khoya Khoya Chand,Drama,Singh's a middle family Mr. Singh and his wife Manju have hosted a small get together in their house where the men are busy boozing and talking about the world. Manju is seen cleaning the ... See full summary »
Dum Maaro Dum,Action,"Sir John Locksley, the greatest jewel thief, decides his most prized possession, the Shalimar Ruby, should be passed on to a worthy successor. He invites the best rival jewel thieves to his island estate to participate in a deadly contest."
Phata Poster Nikhla Hero,Action,Siri hires an unsuccessful actor to play her missing brother in front of her parents to bring the family back together. Black magic also plays a role.
Swagatam,Comedy,"Siri, the younger sister is having her best time at the home until one day, her elder sister Swetha comes back from the college hostel, as her college is shut down due to the COVID-19 pandemic."
Gulmohar,Drama,"Sirivennela is a 1986 Indian Telugu film, directed by K. Vishwanath and Produced by Ch. Ramakrishna Reddy, N. Bhaskara Reddy and Ujjuri Chinaveerraju. The film stars Suhasini, Sarvadaman ... See full summary »"
Ghar Ghar Ki Kahani,Drama,"Sita lives a middle-class lifestyle with her retired and widowed schoolmaster dad, Ramdas. One day she is molested by Prakash and slaps him. A few days later, wealthy Ghanshyamdas, a former... See full summary »"
Anjali,Drama,"Sita Sinha watches as her young son, Bihari fights another young, wealthy lad, Amar for spattering dirt on his body using his car. Sita then intervene, separates both, take them to her ... See full summary »"
Elaan,Action,"Sitadevi lives a comfortable life with her husband and two sons, Rakesh and Rajesh. While celebrating the birth of one of her son's, her husband gets killed in an automobile accident, and ... See full summary »"
Raja Vaaru Rani Gaaru,Romance,"Sitara was born to a Vishkanya but her father fought a pitched battle to keep her away from the evil forces. But what happens when fate brings her back to the doorstep of where it all started? Good or evil, what will Sitara choose?"
Saravana,Action,Situations push a common man to oppose an influential guy in his area and how he develops himself stronger to fight back his enemies forms the crux of the story.
Sapthagiri LLB,Comedy,Situations turn a man who believes in secularism into an extremist. He plots to bomb a monastery where the survivors of a riot take refuge.
Love Marriage,Drama,"Siva steals crores of money from the Home Minister's residence that actually belongs to a gangster. Siva must save the Home Minister's daughter, who is kidnapped by the gangster."
Aap Aye Bahaar Ayee,Comedy,Sivadas (Kishore) is tough-talking encounter specialist in the police department. He has a mission to pin down a gangster and mercenary and is hot on his trail. But life changes for the ... See full summary »
Dhool,Action,"Sivaji, a stage artist, finds whereabouts of his daughter who disappeared two decades ago and finds out that the kidnapper, Gayatri Patel, is an exact lookalike of him."
Mitron,Comedy,"Six backpackers end up in an old abandoned guest house on a stormy night. They find an old Ouija board in the house and decide to play. Slowly, the funfilled night turns into horror for ... See full summary »"
Laxmii,Action,Six bank robbers trying to pull off the perfect heist discover one of them is an undercover cop.
Nachom-ia Kumpasar,Drama,"Six confused, dis-oriented cadets in an Indian Army academy face many obstacles, yet stand together."
Gold,Drama,"Six couples in love must face different problems caused by love itself. Do they resolve their issues and face life anew, or do they succumb under pressure ?"
Yaadhum Oore Yaavarum Kelir,Action,"Six friends, who follow Periyar's ideologies, fall prey to the local caste politics that happens in their hometown. Who is the reason behind this and what happens after?"
Love Hostel,Action,Six longtime couples in different parts of the world share their decades-long love in these tender portraits filmed over the course of one year.
Virndavani Vairagya,Drama,"Six newly-married, diverse, honeymooning couples face marital bliss and discord, finding out more about themselves, their significant others and life in this happy-go-lucky, quirky drama."
Barun Rai and the House on the Cliff,Horror,"Six strangers go on a road trip across Tamil Nadu to get closure on their personal challenges. In the trip, each one wants to fulfil a major wish in their bucket list. But it's a bumpy ride. Will they be able to fulfil their wishes?"
The Dead End,Drama,"Six students from 3 Countries, USA, India and China are moving to College. They soon find themselves in a global competition and it narrows down to: Engineering and Science."
