title,genre,desc
Kumbalangi Nights,Comedy,"Looking to earn money for his family, a young man in the early 1900s travels to Canada to join a small group of fellow Punjabis working in a lumber mill. While there, the men face difficult... See full summary »"
Captain Nawab,Action,"Lord Rama, son of King Dashrath is sent for exile for 14 years. His wife Sita and brother Laxman accompanies him. But she is deceitfully kidnapped by Ravana, The King of Lanka. Thus a might... See full summary »"
Alpha Venus,Action,Lord Shiva accuses Yama for saving the life of a criminal-politician when the latter tries to stop a little girl from dying. Yama is given a few days' time to rectify his action.
Singhasan,Action,"Lord Shiva crashes four friends' bachelor party as he wants to recruit four mortals. After a night of debauchery, they wake up on a deserted island with no memory of how they got there."
Romantic Criminals,Romance,"Lord Shiva goes through an adventurous ride and performs various antics to test the people on earth. Based on Paranjothi Munivar's epic ""Thiruvilayadal Puranam""."
Maradona,Action,"Lot of People in the world have a desire to travel to their dream destination, but a lot of them fail to live, achieve it. This is the story of such 4 complete strangers of different age groups who commonly have an emotional attachment with their Royal Enfield bike meet and start their journey together crossing all the odds. In this journey they discover about life, people and love. Their journey... See full summary »"
Takkari Donga,Action,Love and hate relationship between a bank manager Father in law and an auto rickshaw driver Son in law where both pretend to be one above the other.
Kuttanpillayude Sivarathri,Comedy,"Love can be timeless and boundless. Story revolves around a true love blossoming between 2 sweet adorable persons belonging from two different timelines (1983 and 2020), a HAM Radio acting as fate connecting them to fulfill their destiny."
Amrutham,Comedy,Love hurts but it never fails. Watch this love tale to know what happens when a broken hearted woman is on the verge of giving love another chance through her second marriage.
Arundhati,Horror,"Love is beautiful, but it never mixes well with deception, rejection and betrayal. In this set of short stories, find out how far a person can go for 'love'."
Raajakumara,Action,Love is blind. And two people struck by Cupid will do anything it takes to stay together.
Ghulam-E-Musthafa,Action,"Love is not just blind, it chooses to be blind. Jackson gets the girl of his dreams against all odds, but when she betrays him, his obsession takes on a form so Machiavellian, even he can not predict how far he'll go."
Khoon Pasina,Action,Love Jugaad is a crime thriller which unravels the complexities of relationships and their outcome.Why and how is what the police investigation will unwrap .
Annayya,Comedy,"Love ka Panga, Hungama Play's latest original show is a romantic comedy about a modern city girl who wants to enjoy a peaceful holiday, a desi munda who thinks he's the coolest dude on earth."
Billoo Baadshah,Action,Love Mocktail is a romantic and fun film about the protagonist Aadi's quest for love. Life takes him through a rollercoaster ride and goes through varied experience at several stages ... See full summary »
Aankhen,Action,Love story which revolves across borders
Batwara,Action,"Love, Scandal and Doctors is a story of 5 medical interns who got embroiled in a scandal. They are the prime accused in a murder. The question lies - Are these students even capable of committing such a crime or are they just being framed?"
36 Ghante,Action,"Lovelorn college guy Aakash has been friend-zoned - again. Neha, who he's been pining for a while, broke up and is now with the charming Vishal. Having seen Aakash's patterns one too many ... See full summary »"
Dehati Disco,Comedy,"Lovely Pinky Malhotra is a heart-breaker in the college where she studies, and has a number of young men who would lay down their lives for her. Amongst them are Sunil and Vicky. She is ... See full summary »"
Dhondi Champya - Ek Prem Katha,Comedy,Lovers from two warring snake-charming tribes face life-threatening challenges.
10 Endrathukulla,Action,"Love's wires are crossed in this hilarious caper; strategems and misunderstandings abound as the young protagonists struggle to navigate their way through life, land jobs, and find a place to live."
Drive,Action,"Lovinder Singh, a thief now in custody and facing trial, reflects on his life of crime while the press reflect on how he managed to get away with so much before being arrested."
Nilaave Vaa,Action,"Lucky, is a happy bachelor who finds Kirat, a beautiful woman. He wins her heart for marriage but a murder, crazy uncles and other hijinks come in his way. Will they ever get married??"
Malamaal Weekly,Comedy,"Maan Singh and Prithvi Singh's families have been locked in a property dispute in a court in India. When the Court gives a verdict in favor of Prithvi, Maan hires a bandit named Panna Singh to kill Prithvi and all of his family."
Rowdy Singh,Action,"Maari, a goon with a love for pigeon racing, must challenge the police corruption in his town."
Dushman Devta,Action,"Maayan sees Machakanni on the day of her engagement and both fall for each other. Incidentally her engagement is broken off. But, the enmity between their villages and family threatens their romance."
Swathi Muthyam,Comedy,"Machine depicts the story of racing enthusiasts , who meet each other under mysterious circumstances. As their bond becomes stronger, they eventually fall in love. However, new things begin to unfold, which change their lives forever"
Ginny Weds Sunny,Comedy,"Madhav and Anandi do their best to provide all that they can to Shankar. But when Shankar's biological parents seek custody of their son, things take a different turn."
Nenevaru,Action,"Madhav meets a girl named Riya and falls in love. After stuggling to convince her to be his girlfriend, she half heartedly agrees to be his ""Half Girlfriend"""
Shooter,Action,Madhav Mishra is back to fight his toughest case yet nothing is simple and straightforward. Will justice win?
Queen of Sajjangarh,Horror,"Madhav Verma (Om Puri) is a dedicated, honest, and diligent union representative. He represents the majority of the employees in an organization, which recognizes his union. However, there ... See full summary »"
Thambi,Action,"Madhu and Abhishek after their marriage stay at government quarter. Where Madhu found a Dairy, she came to know that the dairy belong to Kalpana who was staying at the same quarter before them."
Dil,Comedy,"Madhu, a mathematician, becomes depressed after the unexpected deaths of his girlfriend and father. However, when he tries to commit suicide, his look-alike takes him to an unnamed exoplanet."
Sakath,Comedy,'Madhur Milan' is the story of reincarnation and union of Babuji and Fulmati who were lovers in their past life.Babuji was a rich landlord's son while Fulmati was a poor snake charmer's ... See full summary »
Hara Hara Mahadevaki,Comedy,Madhuri (Manju Warrier) an ordinary sales girl takes extra ordinary revenge against Antappn (Roshan Andrews) who misbehaved to her during a bus journey
Khandaani Shafakhana,Comedy,Mahalakshmi confesses to her fiance that whilst at school in city she fell in love with a boy who broke her heart. The fiance sets out to find the philandering boy to teach him a lesson and... See full summary »
Irai,Action,"Mahalakshmi, a traditional girl sets out on a solo honeymoon after her marriage gets cancelled."
Horror Story,Horror,"Maharaj Kans rules Mathura and lives a lavish and wealthy lifestyle. He gets his sister, Devki, married to Vasudev, but shortly after the marriage finds out that Devki's 8th child will kill... See full summary »"
Chhoona Hai Aasmaan,Action,"Maharaja Sharminder Bhupathi of Avanti and his wife, the Rajmata, would like to see peace in the region, and would like their daughter, Alaknanda, to marry the prince of Gandharva, Aditya ... See full summary »"
Farishtay,Action,"Maharaja Vikram decides to marry his daughter Anuradha to his commander's son, Pratap. However, years later, Anuradha is abducted by bandit Suraj while on her way to Pratap's coronation."
Uppi 2,Action,"Maharana Pratap's clashes with Akbar and Man Singh I, which caused the battle of Haldighati."
Gulacha Ganapati,Comedy,"Maharathi Karna is the moving, emotional story of Maharathi and Danveer Karna, one of the most respected character of the epic Mahabharat. Maharathi Karna, a portrayal of the Mahabharata ... See full summary »"
Coolie,Action,"Mahesh, a studio photographer and studio owner gets into a fight and loses. He ends up taking revenge which leads to certain realizations in his life."
Brothers,Action,"Mahi, a newly married woman, brings an antique Jewish box into her home. When Mahi and her husband Sam begin to have paranormal experiences, they soon learn that the box is a dybbuk ... See full summary »"
Kedi Billa Killadi Ranga,Comedy,"'Mahima Shani Dev Ki' TV show breaks all the myths and misunderstandings about Lord Shani (Saturn), one of the nine heavenly objects known as Navagraha in Hindu astrology."
Poochandi,Comedy,"Mahishasur Marddini presents a collage of narratives from a single night. In the film, the four characters hail from the suburbs and stay as paying guests in a house owned by Rituparna ... See full summary »"
2 Harihar Nagar,Comedy,"Maitri who is an apple of her father's eye is kidnapped by an evil spirit, believes that her father is a super-hero who fights against ghosts. How will JD bring his daughter back from the dark world full of evil spirits?"
Aashiqui: True Love,Action,"Maj. Siddhant Chaudhary, an Indian Army lawyer, attempts to defend Capt. Javed Khan who is accused of killing a decorated officer. The problem is that Khan does not wish to be defended and freely admits to his crime."
Bheeshmaparvam,Action,Major Monica Mehra gets involved in an investigation relating to a vigilante outfit and ends up realizing that the key to the mystery lies in her past which has haunted her since her childhood.
Johnny,Action,"Manan, a sincere, Introvert and studious teenager; falls in love with the Fiery and chirpy Mansi in the last year of college. This love story takes a bitter turn and later they meet again ... See full summary »"
Tenali Rama,Comedy,"Manchi Manasulu is a 1986 Indian Telugu film, directed by A.Mohan Gandhi. The film stars Bhanu Chander, Rajani and Bhanu Priya in lead roles. The film has musical score by Ilayaraja."
Don,Action,"Mandar, an ordinary guy is obsessed with sex and chases girls until he meets Tripti and decides to settle down with her."
Rakshak,Action,"Mangal Singh (Rajesh Khanna) has been a career criminal, whose criminal career began to steal food and to keep from starving, and thence got him in deeper and deeper in the criminal world. ... See full summary »"
Keshava,Action,"Manickam, an unruly man, happens to capture on video an illicit affair between a rich married woman and her lover and starts blackmailing her. She, on the other hand, tries her best to outsmart him."
Welcome to Central Jail,Comedy,Manilal's journey through people after the disturbing demise of his father.
Paalaar,Action,Mann Fakiraa revolves around a man who gets into an arranged marriage but realizes he is still in love with another woman from his past. His wife reveals she too has an old flame she has ... See full summary »
Pandu Hawaldar,Comedy,Mannu idealistic approach puts him in tricky situations. A ruthless world that tries to bring him down. Mannu still chooses to see the silver lining in and keep a positive attitude towards life.
Andar Bahar,Comedy,"Manohar, a schoolteacher, leads a dull and unexciting life after the death of his lover. Fortunately, his life takes a new turn when his friends give him a reason to live and love once again."
Jinne Jamme Saare Nikamme,Comedy,Manohara who joins a school only for the sake of acquiring an experience certificate. But he is thrown into deeper conflicts when his connection gets stronger with students and the villagers.
The Zoya Factor,Comedy,"Manorama, the daughter of a rich, orthodox family is married off, leaving her childhood friend Deodhar and his secret love for her, in despair. When tragedy befalls her, and traditions seem unfair, Deodhar must fight for what's right."
Baadshah,Action,"Manorama, wife of an irrigation minister, tasks Satyaveer to find if her husband is cheating. As Satyaveer starts investigating, he gets trapped in a web of lies and must uncover the entire truth."
Dear Friend,Comedy,"Manoranjan, a superstar, is counting his last days due to brain tumor. How he goes about his final wish of doing a comedy film with his mentor Margadarsi forms the crux of the story."
Chatrapathi,Action,"Mansi and Shivani are best friends, one submissive, the other aggressive. They both have completely different views on marriage. Mansi's middle class background has trained her to always ... See full summary »"
I Am Not a Player,Comedy,Mansi Sharma gets Magical Ring which is invented by her late father in law. Because of manufacturing default magical ring fulfill the wish of person who wears it but magic happens with some... See full summary »
Rangasthalam,Action,"Manu, a bodybuilder from Chandigarh, India, falls in love with Maanvi, a Zumba teacher. All seems well until a revelation causes turmoil in their love story."
The Murderer: Hamilton Palace,Action,"Manu's boss in an IT firm is Priya, an evil woman, who verbally abuses and criticises her subordinates. However, Manu's life takes a turn when Priya forces him to act as her husband to avoid going back to Australia."
Bell Bottom,Comedy,Marathi TV Series on life of Great Chatrapati Sambhaji Maharaj.
Rasathanthram,Comedy,"Mariner Aravind, enjoys a happy-go-lucky life with 6 months at sea and 6 months on land. He falls in love with Thulasi, who doesn't reciprocate his love. Eventually love blossoms between ... See full summary »"
Shrikant Bashir,Action,"Mario, a game developer, and his friends must tackle and escape from a rising zombie apocalypse in the region of Rayalaseema."
Jal Wayu Enclave,Romance,Marriage preparations are in full swing for Gautam and Gauri but Gauri is still not sure weather she wants to go further with the relationship due to the misunderstandings between them ... See full summary »
Pranchiyettan and the Saint,Comedy,"Marshal is a medical crime thriller movie directed by Jai Raaja Singh and produced by Abhay Adaka. The movie cast includes Srikanth, Abhay, Megha Chowdhury and Rashmi are in the lead roles. Yaadagiri Varikuppala scored music."
Ishq,Action,Maruthu is a rustic action entertainer where Vishal plays the role of a labourer. The story revolves around his relationship with his grandmother.
Chi La Sow,Comedy,Mask tells the story of a police inspector who sets out to track down a thief.
Happu Ki Ultan Paltan,Comedy,"Master Dinanath is an ex-freedom fighter. When he gets Thakur Pratap Singh arrested for arms smuggling, he has Master's wife Bharati and young daughter Priti kidnapped and also turns his ... See full summary »"
Kallan D'Souza,Comedy,"Match of Life"" is based on a cricketer's life who looks like Virat Kohli and what circumstances he faces in day-to-day life being a normal person with a celebrity face."
Aum Mangalam Singlem,Romance,"Matchmaker Sima Taparia guides clients in the U.S. and India in the arranged marriage process, offering an inside look at the custom in a modern era."
Maut,Horror,"Mati, an 18 year old college going girl, convinces her strict parents to let her go on an independent journey and explore Goa, where she ends up meeting two other girls who come from different walks of life."
Surya,Action,"Matru Devo Bhava is 1988 Indian telugu film directed by N S Dhananjaya and produced by Jai Jagadish & Srinivasamurthy. The film stars Srinivasamurthy, Jayanthi, Jay Jagdish & Thara. The ... See full summary »"
Atithi Bhooto Bhava,Comedy,"Max, who lives with his twin sister Shirley in Goa, is enraged when he finds out that she has fallen in love with Rahul, his bitter rival Prakash's younger brother."
Maid for each other,Romance,"Maya, coming from poor family, is married to the affluent Dr. Anand; but she tries to commit suicide on the nuptial night. She tells Anand that she was in love with Prem whose ambition was ... See full summary »"
Jayantabhai Ki Luv Story,Action,"Mayura, a young woman, leads an unhappy life because the people around her recognise her for her beauty and not for her skills and accomplishments."
Couple Goals Season 3,Comedy,"Medusa, a crime boss is smuggling the Great Indian diamond, hidden in a toy chicken, which gets misplaced in the process. Tanay, Bumpy and Montu, three strangers get drawn into this ... See full summary »"
Veera Sivaji,Action,Meena is an attractive young lady who lives with her middle-classed parents in a city in India. Her father is Parshuram who works as a chaprasi (peon) with an organization run by the ... See full summary »
Samurai,Action,Meena trys to eradicate misconceptions and superstitions from the society and create social awareness about different social phenomenas with occasional help from a wide variety of characters including her parrot companion Mithu.
Yeh Raaste Hain Pyaar Ke,Action,Meenu was born on the same day that Mollywood superstar Mohanlal first appeared on the silver screens across Kerala in the iconic movie Manjil Virinja Pookal.
Mankatha,Action,"Meera begins to suspect every female associate of her husband after she found a stray hair which is not hers. After discussing with her friend, she thought she might be over reacting but does not stop digging up for finding the evidence."
Ezra,Horror,"Meera starts calling bhoomi, her bodyguard just to fool him by telling him she loves him. Problems arise when bhoomi falls in love with her not knowing who she is."
Virgin Bhasskar,Comedy,"Meet Arjun Verma, a conman who plays the biggest odds and wins. Trained in the belly of Bombay, he knows how to score with women, money, and the law. His playground is his alone - AND NOBODY F***S WITH THAT..."
Bombairiya,Comedy,"Meet Jeeta and Mitha, first cousins who live next door to each other but follow very different paths. Jeeta is an electrician and financially supports his family with some help from his grandfather."
Kadhalil Sodhappuvadhu Yeppadi,Comedy,"Meet, Prem, and Amar look to have a blast at their college reunion, though they soon find themselves in another predicament."
Insan,Action,"Meeting accidentally five years after their divorce, a couple reflects on how their marriage collapsed despite transparency."
Touch Chesi Chudu,Action,Mehbooba movie is a romantic love story in the backdrop of 1971 Indo-Pak war.
Sura,Action,"Members of a family are separated in a natural disaster. Several years down the line, they aren't united but their lives are strangely interconnected."
Barooda,Action,"Men in a village are disappearing in the darkness of the night. Is it the work of a mystical enchantress, or is there some other mystery?"
Irandam Kuththu,Comedy,"Mentalist who can read the minds of others, irrespective of how hard they try to hide details from him. Imagine what would happen if cops choose to use such a man to solve crimes?"
Tarazu,Action,"Mere Khwabon Mein Jo Aaye is the story of Maya. Maya lives in New Delhi, is married to Vikram and has a daughter Priya. Maya's life is mundane and centres around her family. One evening she... See full summary »"
Monalisa,Romance,Methagu- II movie spanning over 12 years of history during which Eelam Tamils' lives got radical change from being subjected to ethnic subjugation to getting mobilized towards the freedom struggle spearheaded by Mr. V. Prabaharan.
The Warriorr,Action,"Mia discovers her magic stone is part of an ancient prophecy and embarks on a thrilling journey to the farthest islands of Centopia to face a great evil, and shape her own destiny."
Farzi Mushaira,Comedy,"Michael, Arjun and Lallan, three men from three different strata of society, cross paths one morning in Calcutta and change one another's lives forever."
Na venta paduthunna chinnadevadamma,Action,"'Midnights With Menka' revolves around Malhar Thakar, the superstar of Gujarati film world and his rich best friend Hardik, his biggest fangirl, Esha and his suboptimal sister Riya. Hunger ... See full summary »"
Bhoothnath Returns,Comedy,Miles of Love is a story of how an engaged and career focused girl Neelambhari fell in love with RamaChandraiah a carefree guy in a 9hr journey from Hyderabad to Bangalore.
Samundar,Action,Mill workers are subjected to atrocities and their plight is ignored by the government.
Kuch Kuch Hota Hai,Comedy,Mimi is introduced by Bhanu to an American couple as a surrogate in exchange for Rs 2 million. She decides to have the baby even when they change their mind and tells her parent that Bhanu is the father.
Tahalka,Action,"Mini isn't eager to wed the rich suitor who's been chosen for her, so she stages her own kidnapping and runs off with a man who works for her father."
Dhamaka,Comedy,"Mini shifts to her new house along with her parents Mr. and Mrs. Shrma, as well as, nephew Bunty. Bunty finds a cat in the backyard of the house and gets attracted to it but the cat soon ... See full summary »"
Mela,Action,"Mini, a young girl, encourages her traditional mother, Babita, to realise her worth and fulfil her dreams."
Gubbi Mele Brahmastra,Comedy,"Mirror Game follows University Professor Jay Verma. Stuck in a crumbling marriage and a failing career, Jay seeks a way out of his troubles. Ronnie, an ambitious student, approaches ... See full summary »"
Aswathama,Action,"Mishti, a young woman, is expected to settle for an arranged married by her family. However, she feels that she must get a chance to know her life partner well before tying the knot with him."
Gunga Jumna,Action,Miss India and an aspiring actor spend a night together roaming the streets of Mumbai and unwittingly clash paths with a megalomaniacal gangster planning to take over India.
Chintakayala Ravi,Comedy,Mission Brief: City of Waaji needs your help. The gangsters of Waaji have taken control over the city in search of the Black Box. Their mercenaries run rampant and would kill anyone that cross their path. IT'S SHOWTIME!!.
Sikander,Action,Misunderstandings arise between Akbar and his son Salim when he disapproves his son's love.
Garuda: The Beginning,Action,Misunderstandings cause ACP Suraj Khanna (Vinod Khanna) to be separated from Seema (Hema Malini) with Suraj unaware she is expecting their child. Seema moves away to the Himalayan Mountains... See full summary »
Madhuri Talkies,Romance,"Mitwaa is a love triangle starring Swapnil Joshi as Shivam, Sonalee Kulkarni as Nandini and Prarthana Behere as Avani."
Main Hoon Na,Action,"Mixed with emotions like Sexual Desire, Betrayal, Love and many more, this series consists of 13 episodes. Each episode has a different plot & cast."
Jurm,Action,Modern adaptation of Charles Dickens' Great Expectations; a poor but talented boy falls in love with a girl from an affluent family.
Ek Hi Raasta,Action,"Mohan is a young man who lives with his widowed mother, is in love with a young woman named Shyama, and both would like to get married. Unfortunately, before that could happen, Shyama is ... See full summary »"
Kachche Dhaage,Action,"Mohan Ranga falls in love with Megha Subramanyam, an NRI residing in the United States. Before she can reciprocate his love, circumstances make them fall apart. But destiny has other plans."
Zamaana Deewana,Action,"Mohan Rao and his elder brother face Pedda Shavukar and Chinna Shavukar, a political battle where low caste fights the high caste power."
Madras,Action,"Mohan Sharma (Tarun Bose) is a workaholic whose life changes dramatically after his wife dies giving birth to their daughter Uma (Sharmila Tagore). He despises the daughter by day, and ... See full summary »"
Babu Bangaram,Action,"Moksh to Maya is a sinful journey of the character 'Maya' who is in love with four men at the same time. The movie depicts her life and her choices, some good and some bad. Is she a criminal or a revenge seeker?"
Guest iin London,Comedy,Monotonous routines in the lock-down push a married couple - Sunil and Manjari to their personal extremes. Will they make it through the phase where love and hate exist under one roof?
Velaiilla Pattadhari,Action,"Months after an accident following his marriage, a husband finds that the veiled woman he brought home is not his wife."
Moothon,Action,"Montu as a kid aspired to become a pilot. Instead, he grew up to be a pimp, a courier of prostitutes in the red-light area of the city called 'NeelKuthi'. He became ""Montu Pilot""."
Saheb Biwi Aur Gangster 3,Action,Monu (Mohan) and Sonu (Sohan) are the two sons of a police inspector. The kids excel in boxing. Their father gets killed by a goon following orders from Ranjit (Premnath). Mohan kills the ... See full summary »
C Kkompany,Comedy,"Most love stories end in a marriage, this one starts with it."
Republic,Action,"Motu Patlu go to save Boxer's brother from Modern city from a evil Kungfu Master name Wuhan Gorrila, who has kidnapped this man to get the fourth part of a Map, which will give tell route for the Devil's heart."
Stalin,Action,"Movie is a political thriller based on the atrocities committed by the state of Kerala during the 21 months National Emergency, from 1975 to 1977."
Thappa,Comedy,Movie revolves around a group of people living in a harbor town. The story delves into their love for each other and a certain festival of sacrifices.
Junga,Action,"Movie revolves around Vanavarayan (Rajni), a feudal chieftain of a village, his rivalry with Vallavarayan (Nepolean) and his love with Vaitheeswari (Meena)."
