title,genre,desc
Dassehra,Action,"The story revolves around Uma (Sujitha) who wrongly assumes that her love is reciprocated by Charlie (Kunchacko Boban), the happy-go-lucky boy she grows up with. She realizes her mistake ... See full summary »"
Woodpecker,Drama,The story revolves between two youngsters who are at the age of getting married. The girl seeks to meet the boy with a wish of a denial. On the other end boy with positive mindset without revealing his original identity.
Detective,Action,"The Story revolving around the life of a kind and sweet girl living with her family and her life get into trouble after an incident- but she overcomes the odds and difficulties with her will and fate, leading to consequences."
Hadh Kar Di Aapne,Comedy,The story showcases the delight in modern relationships that dare to explore their deepest and quirkiest desires.
Maryada Ramanna,Action,"The story starts with the inauguration of the first-ever Mechanical batch in an engineering campus consists of boys only. Later in the second year of the department, a girl joins and becomes the only girl to be a part of their batch."
Katilon Ke Kaatil,Action,"The Story takes place in one night, in which a man, with the help of his would-be brother-in-law, hunts for a last liquor before leaving to Saudi Arabia."
Lekh,Drama,"The story through the eyes of Himmat Singh is based on the inspiration was taken from Nineteen Years of nationally significant events, several espionage missions were undertaken by India in the last two decades."
Bandish Bandits,Drama,"The story was about Akshara and Naitik who were bounded by a forcefully arranged marriage thrust upon them by hypocritical society, carried on for seasons as Akshara saved lives (as one ... See full summary »"
Lajwanti,Drama,"The storyline is about 3 characters of Babbu Maan in different places and in different eras but the three stories told are love stories of the individual. A strong, compassionate lover ... See full summary »"
Charminar,Romance,"The storyline of the film is based on apprehension of co-founder of Indian Mujahideen and conspirator of several bom blasts in India, Yasin Bhatkal, by National Investigation Agency near Indo-Nepal border."
Phulala Sugandh Maticha,Drama,"The stroy of the famous Siva devotee, Kanappa."
Ankahee,Drama,The struggle of a family of three as they search for a house to rent after being given an ultimatum to vacate their house by their land lady.
Habji Gabji,Drama,The struggles faced by a business man and his family in Dubai to stabilize themselves after getting cheated by a fraudster.
Barsaat,Action,The struggles faced when a Hindu man falls in love with a Muslim woman and the disapproval of her family.
Yaan,Action,The sword of Tipu Sultan is based on the novel of same name by Bhagwan S Gidwani. It chronicles the life stories of Hadar Ali and Tipu Sultan. The novel is regarded as being historically ... See full summary »
Dharma Durai,Drama,The tale begins in the final days of the British Raj in India. A cohort of engineering students graduate a few months before Independence. Satyapriya and Naren are among the graduate ... See full summary »
Switzerland,Drama,"The tale of Chakor, a free-spirited young girl whose existence is pawned by her helpless and poverty-stricken desperate family when in her mother's womb, as collateral for money."
Subramaniapuram,Action,"The tale of Ratnakara, an average middle class guy in his late twenties, who is stuck in a house with his mother, Saroja. Just when things couldn't get any worse, Ratnakara gets a phone call that turns his life upside down."
SSMB 28,Action,The Tamil version of the trilingual horror-comedy wherein a husband finds out his wife is possessed. Also simultaneously made in Hindi as Tutak Tutak Tutiya (2016) and in Telugu as Abhinetri (2016)
Taranath Tantrik,Horror,"The third film in Ram Gopal Varma's Sarkar trilogy, which chronicles the exploits of a powerful political figure."
Ludo,Action,"The third season is the story of Agastya Rao and Rumi Desai--two people from very different worlds. Not only are their worlds poles apart, they are also a complete contrast to each other. ... See full summary »"
Ambasamudram Ambani,Comedy,The trials and tribulations of sisters Ragini and Sadhna. Ragini and Sadhna are different in terms of beauty.
Aashiqui,Romance,"The trials and triumphs of Malti, an acid attack survivor. From the investigation of the attack to the court proceedings, the medical treatment to the emotional healing. Chhapaak is the story of the unquashable human spirit."
The Reunion,Drama,"The trio reunites in the UK and they fall in love, become involved with a nightclub, and have to face up to the challenge of a local don."
Kurukshetra,Action,"The true love between a couple in 1910, 1960 and 2012. Their love is so strong that even destiny wants to bring them together."
Hate Story 3,Drama,"The truth behind the ascension of Milkha Singh, who was scarred by of the India-Pakistan partition."
The Holiday,Drama,The twin cities sport two sweet shop giants in the form of Siva Reddy (K Vishwanath) and Sahadeva Reddy (Kaikala Satyanarayana). Venu (Jr. NTR) is the teenage grandson of Siva Reddy and ... See full summary »
Talash,Romance,"The twisted love tale of Prince Virendra and Princess Chandrakanta, who are reborn to fight the evil forces of Maricha."
Maanagaram,Action,The unexpected arrival of his elder NRI brother and assorted characters complicates the life of a Goan male.
Never Kiss Your Best Friend,Romance,The untold story of Mahendra Singh Dhoni's journey from ticket collector to trophy collector - the world-cup-winning captain of the Indian Cricket Team.
The Baker and the Beauty,Drama,The ups and downs of a romance between Varun and Nithya from childhood to adolescence.
Anakh Jattan Dee,Action,"The ups and downs of modern-day relationship take the spotlight in this contemporary, slice-of-life story."
Bol Bachchan,Action,The urbane son of a village chieftain struggles between his personal aspirations and those of his family.
Pallavi Anu Pallavi,Drama,"The Verma family consists of Mrs. Verma, the mother; Anil, the son; and a daughter named Vinnie. Anil loves Shobha, and hopes to marry her someday. While Vinnie loves Rakesh and also hopes ... See full summary »"
Udaan,Action,"The Verma family consists of two brothers, Vijay and Sharad (Jeetendra and Govinda respectively), Vijay's wife, Ganga (Reena Roy), and their daughter. Sharad is unmarried and is studying in... See full summary »"
Vishnu,Action,"The village head is a man who sticks to honesty while making judgements. However, when he falls prey to a conspiracy, he bravely fights to ensure that justice prevails in his village."
Godse,Action,"The wacky adventures of a young man who is willing to sacrifice his own love to insure the happiness of others, even trying to get the girl of his dreams married to the guy of her dreams."
Tarkeeb,Action,The warm love story of a landlord and his wife (and their car).
Saturday Night,Comedy,The wealthy patriarch of a Mumbai family learns more than wants to about his own origins after his refusal to accept his sons' chosen spouses drives them and his own wife away.
1996 Dharmapuri,Action,"The web series focuses on the travels of Dr. Vishesh Arora, a sex consultant from a small town. The latest creation by Imtiaz Ali focuses on the doctor and his variety of clients who all are connected to each other."
Gair Kaanooni,Action,"The web series is about Aditya and Vani. Two young writers, met by destiny who eventually fell in love with each other in an old-school romantic manner."
Gabbar Singh,Action,The web series revolves around the lives of university students.
Sethu,Action,"The well known folklore characters, Akbar and Birbal have been extremely popular with the kids for their combined wit and wisdom. The show is a fresh, comic take on the relation between ... See full summary »"
Kumari,Horror,"The world of Kumari, who is married off far away in Kanhirangat, a cursed land beyond Illymala, in the west. A naive Kumari arrives in the cursed land, where people are ready to sacrifice their lives to preserve tradition and power."
Agent Vinod,Action,The writings of Nobel Prize winner Rabindranath Tagore come to life in this collection of tales set in early-20th-century Bengal.
Jomonte Suvisheshangal,Comedy,The young heir of a rich family sets out to effect a reconciliation between estranged family members.
O.P.160/18 Kakshi: Amminippilla,Comedy,"The youngest of the four Sharma brothers is a huge sports buff. When a financial crisis befalls upon the family, he manages to raise a huge sum of money at a great personal sacrifice that no one knows of until it's too late."
Holiday,Action,"Theeran, a police officer, is entrusted with the task to solve the mystery behind a series of murders. The only clue left behind is that all the murders are committed in the same pattern."
Love Breakups Zindagi,Comedy,Theevandi is a political satire depicted through light humor where the protagonist Bineesh hardly knows a thing even about himself.
Michael Madana Kama Rajan,Comedy,"Thennilavu is set in a holiday cottage in Kodaikanal following four couples' honeymoon routine. The four couples include a couple who always plan to murder the other, a couple who are ... See full summary »"
Ravi Bopanna,Drama,"There are 5 stories in this movie, which joins together in the climax."
Sssshh... Phir Koi Hai (Tritiya),Horror,"There is a plant in Chhattisgarh called ""bhulan kaanda"", if you step on that you will forget the way you are going to, and will not recover the situations unless someone touches you. The ... See full summary »"
Jamai Raja,Drama,There is a water dispute between the two villages Chikani and Dekhani. One village has a monopoly on water and the other village is suffering from drought. Meanwhile Sweeti comes to the ... See full summary »
Mmmmm (Sound of Pain),Drama,Theresa's vow to clean up the city from drugs leads her to Deva. Deva's drive to be the drug lord is paved with murders and politics. Will Theresa be able to catch Deva and end the drug war?
Thapki Pyar Ki,Drama,These new IT interns are entering the grown-up world and the possibilities are endless.
Officer Arjun Singh IPS,Action,"They say marriages are made in heaven, but sometimes on planet Earth, you need a little help to find your ideal match. A young and good looking Ricky Malhotra is on the lookout for his ""... See full summary »"
Janhit Mein Jaari,Comedy,Things change when the egos of an upright police officer and a retired army havildar clash.
Please Find Attached,Drama,"Things change when there is a murder of a student in the school and everyone becomes a suspect. And during the investigation, so many secrets will be revealed that might break or make friends and relationships."
Venky Mama,Action,Things take a turn as dramatic events unfold after a crime was committed in a village and as the culprit is sought after.
1942: A Love Story,Action,Thirteen girls from different parts of India compete against one another in a series of challenges to win the hearts of the judges and become one definitive supermodel.
Sahi Re Sahi,Comedy,"Thirty years ago Karam Jindal together with his widowed mom, Gayatri, and wife, Sandhya, had immigrated to London, England. Shortly thereafter Gayatri gets cancer and tragically passes away... See full summary »"
Tere Bin Laden: Dead or Alive,Comedy,Thiru join hands with his brother Guru to face the mobsters of a city.
Ship of Theseus,Drama,"Thiru, a financial analyst swiftly climbs up the corporate ladder. He soon finds his world turned upside down and is set for a collision with a mysterious deadly group headed by a brutal killer."
A Wednesday,Action,"Thiruchitrambalam lives with his father and grandfather. He blames the former for the loss of his mother and sister and is not on good terms with the latter. Meanwhile, his love life is not so successful."
Awaara,Drama,"This 5-episodic series is a story of a happily married couple, Dhwani (Bidita Bag) and Sahir (Barun Sobti). With Dhwani's birthday just around the corner, she is expecting the usual ... See full summary »"
Kuppathu Raja,Comedy,"This a journey of a detective,his life and how things are to him. His life is about following people, finding though he is still in search for himself, how he connects to the people he meets and gets intertwined in their lives."
Om 3D,Action,"This action movie is filled with romance and adventure. As Abhisek fights for his life against the forces of crime and injustice, he meets Bhoomika, who captures his heart."
Devullu,Drama,This action-packed series will witness 2 special task force teams who are on a job to identify and probe in to the heinous crimes that have crippled the state of Tamil Nadu.
Lupt,Horror,"This animated movie depicts Hanuman's life from birth. The narrator is actor Mukesh Khanna. The movie relays how Hanuman was born to Anjani a female Apsara and Kesari, by the blessings of Vayu-Dev, the Wind God."
Vamsee,Action,"This documentary is the most comprehensive look at the ""untouchables"" in India. Motivated by ancient religious edicts, no amount of governmental encouragement has been able to stem the ... See full summary »"
Kathakali,Action,This drama is generally based on different love story around india that goes through 8 seasons have been aired yet
Dekha Pyar Tumhara,Comedy,"This film based on a person, who is surrounded by people, who always diverts father's thoughts, to doubt on his own daughter. But daughters prove everyone wrong and show that girls are not less than anyone."
Salaam-E-Ishq,Comedy,"This film chronicles key events in the life of Chhatrapati Shivaji Maharaj, founder of the Maratha Empire from his birth to his Coronation as ""Chhatrapati"""
Bairi Piya,Drama,This film critiques contemporary attitudes to cultural heritage.
Om Namah Shivay,Drama,This film deals with the Virata Parvam (Book of Virata) of the epic Mahabharatam dictated by Vyasa Maharshi.
Department,Action,This film depicts a romantic love story.
Pandu,Comedy,This film explores the competing strengths of a father's love and an evil spirit's will to possess.
Naya Daur,Action,"This film follows 9 girls from Haiti, Nepal, Ethiopia, India, Egypt, Peru, Cambodia, Sierra Leone, and Afghanistan on their journey to education."
Sunaina,Comedy,"This film has the water scarcity that the city faces severely as its backdrop. It revolves around three interesting characters. 'Baskar', who takes up desalination of seawater as his ... See full summary »"
Tera Mera Saath Rahe,Drama,"This film is a biopic of Dr. Kashinath Ghanekar, legendary Marathi actor, journey to the peak of popularity, events that shaken his personal and professional life unto his unfortunate demise at early age."
Joker,Comedy,"This film is a tale about a young girl who grew up in the slave caste group and how she came to be immortalized as their locality, Maadathy."
Bodyguard,Action,This film is a tribute to master filmmaker Satyajit Ray in his birth centenary and it's inspired by the story behind the making of Ray's iconic film 'Pather Panchali'.
Member Rameshan 9am Ward,Comedy,This film is about coming of age of Megha from teen to woman. Her love stories and how they affect her life. Her heartbreaks and her trauma forms the crux of the story.
Suriyan Satta Kalloori,Drama,This film is about two prisoners who make a master plan to escape the prison. They escape the prison on Vaisakhi and in few hours of they see the Vaisakhi list made by the government in which they were to be pardoned by the Jail minister.
Darr @ the Mall,Horror,This film is all about young lad Pranav Joshi's struggle to buy home in Ahmedabad.
Jamba Lakidi Pamba,Comedy,"This film is mainly based on various true incidents relating to tribles, their culture and their lifestyle. The main characters are Dr. Kanna (Sharad Kapoor), his fiancée Rupi (Ms. Nandita ... See full summary »"
Bole Chudiyan,Comedy,This film shows the relationship of love and friendship .
Raid,Action,This film tracks a hasty marriage through its first 365 days.
Mujhse Dosti Karoge!,Comedy,This final installment in Satyajit Ray's Apu Trilogy follows Apu's life as an orphaned adult aspiring to be a writer.
Manithan,Action,"This Gujarati Movie stars Malhar Thakar as Siddharth, a 23 year young e-shopping delivery boy. During a delivery he gets trapped in a vicious circle of inescapable mystery, which unfolds ... See full summary »"
Fashion,Drama,"This historical epic depicts the life of Rudramadevi, a brave warrior princess, who rose to become one of the prominent rulers of the Kakatiya dynasty in the Deccan Plateau, and one of the few ruling queens in Indian history."
Karnan,Action,"This homage to 1980s teen sex comedies follows a college quiz bowl champion who knows almost everything, except how to talk to women."
Photograph,Drama,"This is a dramatic chain of events in the most glamorous ,swinging era of Hindi films... the 1960s. It was a decade when film stars tasted success and carried their larger than life screen ... See full summary »"
Ninaithen Vandhai,Drama,"This is a family drama. A poor school master had three sons and one daughter. He was very tense for his daughter's marriage. He meets his former student Bablu, who meets Minu and falls in ... See full summary »"
Khatron Ke Khiladi,Action,This is a film about the leader of the 1857 mutiny and his fight against the British rule.
Manje Bistre 3,Drama,This is a great show telecasted every Sunday at 8:00AM on DD National.This show is currently hosted by well known actress Swara Bhaskar.Earlier it has been hosted by many wonderful ... See full summary »
Dil Se Di Dua... Saubhagyavati Bhava?,Drama,This is a historical saga of establishing the Mauryan Empire in India
Dostojee,Drama,"This is a historical saga of the first king of united India, Chandragupta Maurya. And How Chankya helps him throughout his journey."
Vel,Action,"This is a Love story of Hindu boy and Christian girl, where they have a problem among their peoples."
F.A.L.T.U,Comedy,"This is a psychological thriller movie about a man who calls himself as ""Naanu"" (Me). It explores the human needs and greeds in the form of a metaphorical comparison to the three female characters in the movie."
Ajay,Action,"This is a Slice of Life story of a young couple Siddharth and Shruti who are deeply in love with each other. After reminiscing about their life they decide to get married. But initially, ... See full synopsis »"
Bandhe Haath,Action,"This is a story about love, friendship and music. Two copywriter brothers have lost in pop music contest called Jhankaar Beats for the last two years. They take the help of an apprentice to compete in a music contest."
Vijaypath,Action,"This is a story of a middle aged lady in the multitude her of roles: a wife, a mother, a daughter, a sister, a friend and an entrepreneur. Her wage-earning comes through tiffin services. ... See full summary »"
Vitthal Teedi,Drama,"This is a story of four girlfriends who go on a road trip in Thailand as a part of the bride's bachelorette, the journey though, turns into an emotional roller coaster."
Meendum Oru Kadhal Kadhai,Drama,"This is a story of three men first one is Jai frank and fearless journalist and crusader, for whom the most dangerous of swords, guns, or bombs are no match. He may lay down his life, but ... See full summary »"
Guvva Gorinka,Romance,"This is a story of two lawyer brothers, their half brother, their wives and children. Siddheshwari, wife of the eldest brother has left the operational details of the household to Sheela, ... See full summary »"
Time Out,Drama,This is test input used in the Cucumber automated tests -test1234
Jaadugar,Comedy,"This is the action-packed story of a hot-headed protagonist looking to solve the murder of his godfather. There are multiple suspects, each of whom has strong motives for the deed."
Dobaara,Drama,"This is the second film about the detective Feluda (Soumitra Chatterjee) set in the holy city of Benares, where he (along with his cousin, Topshe and friend, Lalmohan Ganguly) goes for a ... See full summary »"
Ek Mutthi Aasmaan,Drama,"This is the story of a 12-year-old girl named ""Thaki"" from Dhangar society. Her parents are preparing for her marriage but she wants to learn she doesn't want to get married. In the film ""Waghar"" we will see if Thaki succeeds in this."
Kyaa Kool Hai Hum,Comedy,"This is the story of a guy name Jaysukh, whose father has left tremendous amount of debt on him, while he is single earning person and he has to repay back of his father debt. Jaiyukhcomes ... See full summary »"
Undiporaadhey,Romance,This is the story of a man and woman who were joined together by destiny and how they were thrown into the brink of divorce due some unexpected twists and turns. The film will be a complete... See full summary »
Chakra the Invincible,Action,"This is the story of a simple, happy go lucky, poor but with a heart of gold man named ""Narya"" (Shri P.L.Deshpande) who lives in a chawl and works at a local grocery stores. His loyal and ... See full synopsis »"
Do Minute,Drama,"This is the story of an ancient meditation technique named Vipassana, which shows people how to take control of their lives and channel them toward their own good.It is the story of a ... See full summary »"
Awara,Action,"This is the story of an honest businessman who is conned by his own partner, yet receives help from three escaped prisoners."
Bebaakee,Drama,"This is the story of Lord Ram and his years spent in exile with his wife and brother, and also chronicles the end of the demon king Ravan and his family."
Udta Punjab,Action,"This is the story of Lord Shiva and Goddess Shakti. It is an elaborated narration of Shiv and Shakti's separation and union, their journeys together, and how that affected and shaped the ... See full summary »"
Angrej,Romance,"This is the story of modern-day Duryodhan on the hunt for the Pandavas and Draupadi, reborn in the 21st century."
We R Friends,Drama,This is the story of Murari who wants to become a filmstar. He runs away from his house and goes to Mumbai to become a superstar. When he reaches Mumbai his whole world turns upside down. ... See full summary »
Sailaja Reddy Alludu,Action,"This is the story of Sanjana, a girl of today's generation full of life and vibrant ecstasy. She lives life on her own terms and gets very upset when her mother Susheela, arranges for her to see a boy leading to a marriage prospect."
Brahmastra Part One: Shiva,Action,"This is the story of Shiva who sets out in search of love and self-discovery. During his journey, he has to face many evil forces that threaten our existence."
Thanga Magan,Action,"This is the story of six Punjabis from India, Pakistan and their struggle to get settled."
Ferrari Ki Sawaari,Comedy,"This is the story of three brothers Gangaram, Moti and Shiv. Story revolves around Moti who is now an advocate in the big city owing to loan which his brother Gangaram took for his ... See full summary »"
Sukh Mhanje Nakki Kay Asta,Drama,This is the story of three conflicted men on an intense chase revolving around a missing car. What is the mystery behind this car?
Middle Class Love,Comedy,This is the story of Tukaram's transformation into a extremely compassionate spiritual saint.
M.L.A. Fatakesto,Action,"This is the story of two men from opposite ends of the spectrum of life, who somehow get inexplicably intertwined. The story happens over 24 hours, from the dawn of the eve of Bakrid to the dawn of Bakrid"
Malang - Unleash the Madness,Action,"This is the tale of a middle-class girl turned accomplished lawyer, Maya Ahuja, who finds inventive ways to escape sticky situations. She cleverly pulls off a big deception to make things work her way."
Bohomaan,Drama,This movie chronicles the life of a South Indian ruler of the Satavahana Empire in South India in the 2nd century CE.
Dishkiyaoon,Action,This movie deals with the later part of Ramayana written by Valmiki Maharshi and depicts the lives of the sons of Rama & Sita.
Hurdang,Drama,This movie is a brutal look at coming of age in a city whose citizens have been famished by brutality and sin for centuries. It is said that the night sky of Mumbai has been forever haunted... See full summary »
Izzat,Drama,This movie is about a homely mother with two kids fighting for their survival against the titular ghost. A married couple enters into their new home along with their two kids and ... See full summary »
Wife for Night,Drama,"This movie is about the life of a middle class, widowed father, Shrikant that takes an unexpected turn when his seven year old Son, Mandar collapses and is referred to Jansanjeevani ... See full summary »"
Rangbaaz,Action,This movie is about three characters who are connected to the Internet and end up disconnecting their actual life.
Pardes Mein Hai Mera Dil,Romance,This movie is filled with full of action and romance. The relationship between a brother and a sister is beautifully portrayed in this film.
Keemat: They Are Back,Action,This movie reflects the time and era in India's history. A time that most politicians would prefer to turn a nelson's eye on; an era that would be excluded from most history books. This ... See full summary »
Utsav,Drama,"This onscreen adaptation of the story 'Pranayopanishad' (The Upanishad of Love) follows Ulahannan, a middle aged government servant, through his emotional journey of misconceptions and love."
Shaitaan Haveli,Comedy,"This play comprises the proceedings of this Court in which the defense lawyer, the extremely sharp Bikash Ray, goes deep into the motive behind the assault and exposes the ugly and shocking truth."
Aasai,Drama,"This revolves around the college boys group, where they make hilarious comments on college management and other things."
